,prev_text,target_text,next_text,label
0,One is called Carbon Engineering.,They're based out of Canada.,"They use a liquid-based approach for separation combined with burning super-abundant, cheap natural gas to supply the heat required.",0
1,"My doctor turned serious and he looked at me and said, ""Travis, that's a lot of opioids.","You need to think about getting off the meds now.""","In two months of escalating prescriptions, this was the first time that anyone had expressed concern.",1
2,"We're leaving that culture, we're out of there.","We're going to get so good at paying creators, within 10 years, kids graduating high school and college are going to think of being a creator as just being an option -- I could be a doctor, I could be a lawyer, I could be a podcaster, I could have a web comic.",It's just going to be something you can do.,1
3,This is not true.,"What is rewarding about helping is knowing that your help landed, that it had impact, that you were effective.","If I have no idea how my help affected you, how am I supposed to feel about it?",1
4,"Instead of looking for reasons out there, we should be looking for reasons in here:",Who am I to be?,"You might decide to be a pink sock-wearing, cereal-loving, country-living banker, and I might decide to be a black sock-wearing, urban, donut-loving artist.",0
5,,Theater matters because democracy matters.,"Theater is the essential art form of democracy, and we know this because they were born in the same city.",1
6,"They're big, hot planets that are easy to see.","We're not ready, we don't have the right technology yet to study small exoplanets.","But nevertheless, I wanted to try to explain to you how we study exoplanet atmospheres.",1
7,"And in that same decade, somebody -- legend has it, somebody named Thespis -- invented the idea of dialogue.","What does that mean, to invent dialogue?","Well, we know that the Festival of Dionysus gathered the entire citizenry of Athens on the side of the Acropolis, and they would listen to music, they would watch dancing, and they would have stories told as part of the Festival of Dionysus.",0
8,"We have to socialize our girls to be comfortable with imperfection, and we've got to do it now.",We cannot wait for them to learn how to be brave like I did when I was 33 years old.,"We have to teach them to be brave in schools and early in their careers, when it has the most potential to impact their lives and the lives of others, and we have to show them that they will be loved and accepted not for being perfect but for being courageous.",1
9,A world full of only easy choices would enslave us to reasons.,"When you think about it,","it's nuts to believe that the reasons given to you dictated that you had most reason to pursue the exact hobbies you do, to live in the exact house you do, to work at the exact job you do.",0
10,She found that bright girls were quick to give up.,"The higher the IQ, the more likely they were to give up.","Bright boys, on the other hand, found the difficult material to be a challenge.",1
11,We need to meet them where they are.,We need to put ourselves into boy culture.,We need to change the mindset of acceptance in boys in elementary schools.,1
12,"And one day they featured a video of my band on the homepage, which was amazing -- we got a bunch of new fans.","We also got a bunch of people who, I guess, just didn't really like the music or something --","It's OK because people started coming to our shows, and we started touring, and we came out with a record.",1
13,They get pictures.,They get to know that they made a difference.,"And this is something we need to all be doing in our everyday lives, especially if we want people to continue to give us help over the long term.",1
14,"When states face each other, China and the U.S., they face each other like this.","When cities interact, they interact like this.","China and the U.S., despite the recent meta-meeting in California, are locked in all kinds of anger, resentment, and rivalry for number one.",0
15,"And I thought, if I'm going to make a story, what's the last thing I'm going to put in there?","Well, what would a Tudor gentleman be preoccupied with?","And I thought, well, Henry VIII, okay.",1
16,Right?,You'd never want to play.,"So I've been talking about this, suggesting, perhaps, that mind-wandering causes unhappiness, but all I've really shown you is that these two things are correlated.",1
17,"If before I was resisting, then now I was surrendering, giving up trying to control the uncontrollable and just being there in it with her.","Time slowed down, and the date was irrelevant.",We developed a routine.,1
18,The result is that I was launched into acute opioid withdrawal.,"The result, put another way, was hell.",The early stages of withdrawal feel a lot like a bad case of the flu.,1
19,"To be sure that this new economy benefits us all and not just the plutocrats, we need to embark on an era of comparably ambitious social and political change.",We need a new New Deal.,,1
20,And so this is a very serious problem.,Where is it coming from?,It's coming from us.,0
21,What's going on?,"Well, at the fifth grade level, girls routinely outperform boys in every subject, including math and science, so it's not a question of ability.",The difference is in how boys and girls approach a challenge.,1
22,"OK, second tip.","This is really important: please avoid disclaimers, apologies and bribes.","Really, really important.",1
23,Why are we here?,Why does our universe exist?,How did Earth form and evolve?,0
24,President Barack Obama said that.,Why do I know it by heart?,Because he said it to me.,0
25,"Years of research in Redding, Pennsylvania led her to write this play about the deindustrialization of Pennsylvania: what happened when steel left, the rage that was unleashed, the tensions that were unleashed, the racism that was unleashed by the loss of jobs.","We're taking that play and we're touring it to rural counties in Pennsylvania, Ohio, Michigan, Minnesota and Wisconsin.","We're partnering with community organizations there to try and make sure not only that we reach the people that we're trying to reach, but that we find ways to listen to them back and say, ""The culture is here for you, too.""",0
26,"Time slowed down, and the date was irrelevant.",We developed a routine.,Early each morning I would crawl into bed with her and sleep with her.,1
27,"But because he was born in the prison, everybody loved him, including the guards, so he was the only one who was allowed to come in and out of the bars.","So, you know, there's bars.","And by the time that Vishna was getting bigger, which means what gets bigger?",0
28,And I've never met him.,"We've only communicated via this telepresence system, which always makes me think of him as the man inside the Internet.",And he is English.,0
29,"Within a few years, we found the gene.",We patented it so that it would be freely available.,We created a diagnostic test.,1
30,And I'm incredibly proud of that.,"When I took over Joe's old job at the Public in 2005, I realized one of the problems we had was a victim of our own success, which is:","Shakespeare in the Park had been founded as a program for access, and it was now the hardest ticket to get in New York City.",1
31,They found it energizing.,They were more likely to redouble their efforts.,What's going on?,1
32,Here's a NASA model and science data from satellite showing the 2017 hurricane season.,You see Hurricane Harvey there?,Look at all the dust coming off of Africa.,0
33,"And what surprised me as well was that as much as this is based on the most sophisticated technology, as much as this is an incredibly new thing, the physical process itself has been around for a long time, and the culture is the same.",You see the local laborers.,You see the English engineer giving directions in the background.,0
34,"So we would collect blood and medical histories, and require that all scientists using these resources would share results with each other and with the people who donated.","Well before the internet was in common use, Pat and I established PXE International, a nonprofit dedicated to initiating research and conducting it on PXE and also supporting individuals with the disease.","Using traditional media, we garnered around 100-150 people around the world who we asked, would you give us your blood, your tissue, your medical histories, your medical records?",0
35,Who would I meet?,"You know, was there something actually out there?","And the answer, by all accounts, was no. This was the Internet, this black box with a red light on it, as represented in the sitcom ""The IT Crowd.""",0
36,"But second of all, I would leave you with the story of Vishna, who actually was my inspiration for starting International Bridges to Justice.",Vishna was a 4-year-old boy when I met him who was born in a Cambodian prison in Kandal Province.,"But because he was born in the prison, everybody loved him, including the guards, so he was the only one who was allowed to come in and out of the bars.",0
37,We put together a research consortium.,We held research meetings and opened a center of excellence.,"We found more than 4,000 people around the world who had PXE, and held patient meetings and did clinical trials and studies.",0
38,Versace without the vowels.,Zhuomani instead of Armani.,"S. Guuuci, and -- All around the world this is how products are being distributed, so, for instance, in one street market on Rua 25 de Março in São Paulo, Brazil, you can buy fake designer glasses.",0
39,How does that depend on what people are doing?,"This shows the rate of mind-wandering across 22 activities ranging from a high of 65 percent when people are taking a shower, brushing their teeth, to 50 percent when they're working, to 40 percent when they're exercising, all the way down to this one short bar on the right that I think some of you are probably laughing at.",Ten percent of the time people's minds are wandering when they're having sex.,1
40,"This show is actually on the PBS digital network -- 29,000 dollars per month.","This is a duo sailing around the world, getting paid every month for documenting their travels from 1,400 patrons.","This is a podcast, ""Chapo Trap House"", making -- actually, since I screenshotted this, they're making an additional 2,000 dollars per month, so they're now making 56,000 dollars per month for their podcast.",1
41,Global Thermostat takes a different approach.,"They focus on the heat required and the speed in which it moves through the material so that they're able to release and produce that CO2 at a really fast rate, which allows them to have a more compact design and overall cheaper costs.",And there's more still.,1
42,It sounds like Milton Friedman or Ronald Reagan.,Wrong.,President Barack Obama said that.,1
43,"They have lifted billions out of poverty.""",Who said it?,It sounds like Milton Friedman or Ronald Reagan.,0
44,"A kindergarten teacher I know, her son donated all of his toys to her, and when he did, she had to go through and pull out all the little plastic guns.",You can't have plastic knives and swords and axes and all that kind of thing in a kindergarten classroom.,What is it that we're afraid that this young man is going to do with this gun?,1
45,We created the modern welfare state.,We created public education.,We created public health care.,1
46,Here are my thoughts.,You take inventory of your own biases.,And I'm challenging you all to do that.,0
47,"Coincidentally, at the same time, the first easy-to-use clinical tests for diagnosing autism were introduced.",You no longer had to have a connection to that tiny circle of experts to get your child evaluated.,"The combination of ""Rain Man,"" the changes to the criteria, and the introduction of these tests created a network effect, a perfect storm of autism awareness.",1
48,We held research meetings and opened a center of excellence.,"We found more than 4,000 people around the world who had PXE, and held patient meetings and did clinical trials and studies.","Through all this, we lived with fear.",0
49,How does Vermeer know her?,"Well, there've been suggestions that she is his 12-year-old daughter.",The daughter at the time was 12 when he painted the painting.,1
50,"The remaining scenes in the ceiling, they mirror the crowded chaos of the world around us.",You have Noah and his Ark and the flood.,You have Noah.,0
51,He classified autism as a form of infantile psychosis caused by cold and unaffectionate parents.,"These children, he said, had been kept neatly in a refrigerator that didn't defrost.","At the same time, however, Kanner noticed that some of his young patients had special abilities that clustered in certain areas like music, math and memory.",1
52,Yes.,Yes.,But you know what we really need?,0
53,"We joined with, and I eventually led, Genetic Alliance -- a network of health advocacy, patient advocacy, research and health organizations.","We built scalable and extensible resources, like biobanks and registries and directories of support for all diseases.","And as I learned about all those diseases and all those disease communities, I realized that there were two secrets in health care that were impacting me greatly.",1
54,How can we make sure that this is implemented?,"This is fantastic.""","And he said to me, ""Well, do you have money?""",1
55,Let's say you're deciding what to have for breakfast.,You could have high fiber bran cereal or a chocolate donut.,Suppose what matters in the choice is tastiness and healthfulness.,0
56,It's just going to be something you can do.,We're figuring it out.,It's going to be a viable and sustainable and respected profession.,1
57,But we also need to be willing to invest as a global society.,"We could have all of the clever thinking and technology in the world, but it's not going to be enough in order for this technology to have a significant impact on climate.","We really need regulation, we need subsidies, taxes on carbon.",1
58,"Dependence is simply the brain's natural response to an opioid-rich environment and so there was every reason to think that from the beginning, I would need a supervised, well-formed tapering plan, but our health care system seemingly hasn't decided who's responsible for patients like me.","The prescribers saw me as a complex patient needing specialized care, probably from pain medicine.","The pain docs saw their job as getting pain under control and when I couldn't get off the medication, they saw me as the purview of addiction medicine.",1
59,We're richer.,We live longer.,We have access to technology that would have seemed like science fiction just a few years ago.,0
60,Who's heard of Twitch?,Twitch streamers are making three to five thousand bucks a month streaming gaming content.,"The big ones are making over 100,000 dollars a year.",1
61,"He'd be preoccupied with his inheritance, with his heir.",Who is going to inherit his name and his fortune?,"You put all those together, and you've got your story to fill in that gap that makes you keep coming back.",1
62,"And believe it or not, and I know some of you are like, ""Yeah, right,"" we're about 90 percent accurate, or more, with weather forecast.","You just tend to remember the occasional miss, you do.","So confirmation bias, Dunning-Kruger and cognitive dissonance.",0
63,We have superstar technologists.,We have superstar bankers.,We have superstar lawyers and superstar architects.,1
64,This is called an air contactor.,"You can see it has to be really, really wide in order to have a high enough surface area to process all of the air required, because remember, we're trying to capture just 400 molecules out of a million.","Using the liquid-based approach to do this, you take this high surface area packing material, you fill the contactor with the packing material, you use pumps to distribute liquid across the packing material, and you can use fans, as you can see in the fro",1
65,"Instead, you may ask yourself, what do we have?","Well, curtains up on the Sistine Chapel.","And I mean literally, you're surrounded by painted curtains, the original decoration of this chapel.",0
66,They collectively represent every one of 86 occupational categories and hail from over 80 countries.,"What I'd like to do with the rest of my time with you today is talk a little bit about one of the areas that we've been investigating, and that's mind-wandering.","As human beings, we have this unique ability to have our minds stray away from the present.",1
67," It's that the Gala sausage roll is a product that's made by a global company called UAC foods that's active throughout Africa and the Middle East, but the Gala sausage roll is not sold in stores.",UAC foods has recognized that it won't sell if it's in stores.,"It's only sold by a phalanx of street hawkers who run around the streets of Lagos at bus stations and in traffic jams and sell it as a snack, and it's been sold that way for 40 years.",0
68,"Instead, you faced alternatives that were on a par -- hard choices -- and you made reasons for yourself to choose that hobby, that house and that job.","When alternatives are on a par, the reasons given to us, the ones that determine whether we're making a mistake, are silent as to what to do.","It's here, in the space of hard choices, that we get to exercise our normative power -- the power to create reasons for yourself, to make yourself into the kind of person for whom country living is preferable to the urban life.",0
69,"And I'll just never forget when I started working on exoplanet atmospheres 20 years ago, how many people told me, ""This will never happen.",We'll never be able to study them.,"Why are you bothering?""",1
70,"So we're living in the age of surging income inequality, especially at the top.","What's driving it, and what can we do about it?","One set of causes is political: lower taxes, deregulation, particularly of financial services, privatization, weaker legal protections for trade unions, all of these have contributed to more and more income going to the very, very top.",0
71,"And by the time they're adults, whether they're negotiating a raise or even asking someone out on a date, they're habituated to take risk after risk.",They're rewarded for it.,"It's often said in Silicon Valley, no one even takes you seriously unless you've had two failed start-ups.",1
72,And then Michelangelo threw a curveball.,Who is in that other arm?,"Eve, first woman.",0
73,"I think most of you do, but millions of parents worldwide continue to fear that vaccines put their kids at risk for autism.",Why?,Here's why.,0
74,You can smell them.,You can get a feel for them.,You can experience their sense of place.,0
75,Is there life out there?,Who is out there?,"You know, this question has been around for thousands of years, since at least the time of the Greek philosophers.",0
76,"China and the U.S., despite the recent meta-meeting in California, are locked in all kinds of anger, resentment, and rivalry for number one.",We heard more about who will be number one.,Cities don't worry about number one.,0
77,Who am I to be?,"You might decide to be a pink sock-wearing, cereal-loving, country-living banker, and I might decide to be a black sock-wearing, urban, donut-loving artist.",What we do in hard choices is very much up to each of us.,1
78,"I would sweat profusely almost constantly, and yet if I managed to get myself out into the hot August sun, I might look down and find myself covered in goosebumps.",The restlessness that had made sleep difficult during that first week now turned into what I came to think of as the withdrawal feeling.,It was a deep sense of jitters that would keep me twitching.,1
79,How do we step out of the boxes that are cornering our perceptions?,"Well we don't even have to go to Houston, we can come very close to home.","Remember ""Snowpocalypse?""",0
80,Dunning-Kruger.,Two scholars from Cornell came up with the Dunning-Kruger effect.,"If you go look up the peer-reviewed paper for this, you will see all kinds of fancy terminology: it's an illusory superiority complex, thinking we know things.",0
81,And this is one of our creators.,"They're called ""Kinda Funny.""","They have about 220,000 subscribers on YouTube.",1
82,They stretch across the ocean.,"They're three or five or eight thousand miles in length, and if the material science and the computational technology is incredibly complicated, the basic physical process is shockingly simple.","Light goes in on one end of the ocean and comes out on the other, and it usually comes from a building called a landing station that's often tucked away inconspicuously in a little seaside neighborhood, and there are amplifiers that sit on the ocean floor that look kind of like bluefin tuna, and every 50 miles they amplify the signal, and since the rate of transmission is incredibly fast, the basic unit is a 10-gigabit-per-second wavelength of light, maybe a thousand times your own connection, or capable of carrying 10,000 video streams, but not only that, but you'll put not just one wavelength of light through one of the fibers, but you'll put maybe 50 or 60 or 70 different wavelengths or colors of light through a single fiber, and then you'll have maybe eight fibers in a cable, four going in each direction.",1
83,"During the first week, when the girls are learning how to code, a student will call her over and she'll say, ""I don't know what code to write.""","The teacher will look at her screen, and she'll see a blank text editor.","If she didn't know any better, she'd think that her student spent the past 20 minutes just staring at the screen.",0
84,You see the local laborers.,You see the English engineer giving directions in the background.,"And more importantly, the places are the same.",0
85,"But to do that, we'd have to be able to look at the planet's atmosphere, because the atmosphere acts like a blanket trapping heat -- the greenhouse effect.",We have to be able to assess the greenhouse gases on other planets.,"Well, science fiction got some things wrong.",1
86,"Lorna and John knew how hard it was to raise a child like Susie without support services, special education, and the other resources that are out of reach without a diagnosis.","To make the case to the National Health Service that more resources were needed for autistic children and their families,",Lorna and her colleague Judith Gould decided to do something that should have been done 30 years earlier.,1
87,And it was an article in 2014 on political motive asymmetry.,What's that?,That's what psychologists call the phenomenon of assuming that your ideology is based in love but your opponents' ideology is based in hate.,0
88,"Bank of America building, there, in Atlanta.","You never hear anyone say, ""Do you believe, if you go to the top of that building and throw a ball off, it's going to fall?""","You never hear that, because gravity is a thing.",0
89,"In fact, we live in a 21st-century world of interdependence, and brutal interdependent problems, and when we look for solutions in politics and in democracy, we are faced with political institutions designed 400 years ago, autonomous, sovereign nation-states with jurisdictions and territories separate from one another, each claiming to be able to solve the problem of its own people.","Twenty-first-century, transnational world of problems and challenges, 17th-century world of political institutions.",In that dilemma lies the central problem of democracy.,1
90,"But of course, we hear the question, ""Do you believe in global warming?""","Well, consider these facts.","The American Association for the Advancement of Science, AAAS, one of the leading organizations in science, queried scientists and the public on different science topics.",0
91,"The girls will come in and say, ""Professor, there's something wrong with me.""","We have to begin to undo the socialization of perfection, but we've got to combine it with building a sisterhood that lets girls know that they are not alone.",Because trying harder is not going to fix a broken system.,1
92,But I also don't want you to be disillusioned.,"These are not large enough to solve our climate crisis, and so what we need to do is we need to actually think about what it could take.","One thing I'll absolutely say is positive about the carbon markets is that they allow for new capture plants to be built, and with every capture plant built, we learn more.",1
93,So what I'm showing you here is what a system might look like to do just this.,This is called an air contactor.,"You can see it has to be really, really wide in order to have a high enough surface area to process all of the air required, because remember, we're trying to capture just 400 molecules out of a million.",0
94,Social entrepreneurship.,Yeah.,Absolutely.,0
95,"I was given what I now know is a much too aggressive tapering regimen, according to which I divided my medication into four doses, dropping one each week over the course of the month.",The result is that I was launched into acute opioid withdrawal.,"The result, put another way, was hell.",1
96,"That other person has an opinion too, and it's drama, remember, conflict -- they disagree with me.",There's a conflict between two points of view.,And the thesis of that is that the truth can only emerge in the conflict of different points of view.,0
97,"Yes, it's better to make more money rather than less, or to graduate from college instead of dropping out, but the differences in happiness tend to be small.","Which leaves the question, what are the big causes of happiness?","I think that's a question we haven't really answered yet, but I think something that has the potential to be an answer is that maybe happiness has an awful lot to do with the contents of our moment-to-moment experiences.",1
